sample_id,task_name,split,source_dataset,input_text,target_text,token_count,early_loss,surprise_score,replay_selection_score,was_selected_for_replay,utility_label,utility_score,label_method
arc_challenge_train_000100,arc_challenge,train,allenai/ai2_arc,"Task: Answer the multiple-choice science question.
Question: Which food provides the most energy for the body in the shortest amount of time?
Options:
A. potato
B. meat
C. milk
D. fruit
Answer:",fruit,2,0.923931121826172,0.3509883880615234,0.3509883880615234,0,0,0.3509883880615234,proxy_replay_selection_v1
arc_challenge_train_000007,arc_challenge,train,allenai/ai2_arc,"Task: Answer the multiple-choice science question.
Question: An old T-shirt can be ripped into smaller pieces and used as rags. An empty milk jug can be used to water houseplants. Both of these are examples of how
Options:
A. saving water conserves future resources
B. using old materials can waste money
C. plants need water to be healthy
D. everyday materials can be reused
Answer:",everyday materials can be reused,7,1.0061066150665283,0.0051728365942835,0.0051728365942835,0,0,0.0051728365942835,proxy_replay_selection_v1
arc_challenge_train_000076,arc_challenge,train,allenai/ai2_arc,"Task: Answer the multiple-choice science question.
Question: One astronomical unit is the average distance between the Earth and the Sun. This unit is most often used to describe the distance between which two objects?
Options:
A. from galaxy to galaxy
B. from Saturn to Mercury
C. from the Sun to Proxima Centauri
D. from the Big Dipper to the Little Dipper
Answer:",from Saturn to Mercury,5,0.5104147791862488,0.0006636191392317,0.0006636191392317,0,0,0.0006636191392317,proxy_replay_selection_v1
arc_challenge_train_000016,arc_challenge,train,allenai/ai2_arc,"Task: Answer the multiple-choice science question.
Question: Joann is testing soils to see which kind is best for growing marigolds. Which of the following should she do?
Options:
A. Plant the marigolds in the same soil, but water some plants more than others.
B. Plant the marigolds in one kind of soil, radishes in another, and daisies in a third kind.
C. Plant the marigolds three kinds of soil, and give them different amounts of sun.
D. Plant the marigolds in three kinds of soil, and give them the same amounts of water and sun.
Answer:","Plant the marigolds in three kinds of soil, and give them the same amounts of water and sun.",23,0.2507885098457336,0.0016570977168157,0.0016570977168157,0,0,0.0016570977168157,proxy_replay_selection_v1
