sample_id,task_name,split,source_dataset,input_text,target_text,token_count,early_loss,surprise_score,replay_selection_score,was_selected_for_replay,utility_label,utility_score,label_method
arc_challenge_train_000091,arc_challenge,train,allenai/ai2_arc,"Task: Answer the multiple-choice science question.
Question: Which of the following statements best describes one way that the Moon is different from Earth?
Options:
A. The Moon is not solid.
B. The Moon has no gravity.
C. The Moon has almost no atmosphere.
D. The Moon receives almost no solar light.
Answer:",The Moon has almost no atmosphere.,8,0.4486313760280609,0.4486313760280609,0.9476164837525928,1,1,0.9476164837525928,proxy_replay_selection_v1
arc_challenge_train_000068,arc_challenge,train,allenai/ai2_arc,"Task: Answer the multiple-choice science question.
Question: A student blew air into a beach ball and sealed it. She then pushed on the middle of the beach ball. What happened to the air inside the beach ball?
Options:
A. The air in the beach ball escaped.
B. The air in the beach ball became a liquid.
C. The type of air in the beach ball changed.
D. The shape of the air in the beach ball changed.
Answer:",The shape of the air in the beach ball changed.,12,0.1331706345081329,0.1331706345081329,0.9506521484767032,1,1,0.9506521484767032,proxy_replay_selection_v1
arc_challenge_train_000007,arc_challenge,train,allenai/ai2_arc,"Task: Answer the multiple-choice science question.
Question: An old T-shirt can be ripped into smaller pieces and used as rags. An empty milk jug can be used to water houseplants. Both of these are examples of how
Options:
A. saving water conserves future resources
B. using old materials can waste money
C. plants need water to be healthy
D. everyday materials can be reused
Answer:",everyday materials can be reused,7,1.522949457168579,1.522949457168579,0.9918759825291714,1,1,0.9918759825291714,proxy_replay_selection_v1
arc_challenge_train_000065,arc_challenge,train,allenai/ai2_arc,"Task: Answer the multiple-choice science question.
Question: The water cycle describes the movement of the water of Earth. About 96% of the water of Earth is the salt water found in the oceans while the remaining 4% is fresh water. Where would the majority of the freshwater on Earth be found?
Options:
A. groundwater and aquifers
B. swamps and wetlands
C. ice caps and glaciers
D. lakes and rivers
Answer:",ice caps and glaciers,7,0.4580036997795105,0.4580036997795105,0.4572993518032032,0,0,0.4572993518032032,proxy_replay_selection_v1
